{
  "version": "1.0",
  "timestamp": "2026-04-18T00:22:38.926Z",
  "phase": "5",
  "phase_name": "not started",
  "phase_dir": ".planning/phases/05",
  "plan": 0,
  "task": 0,
  "total_tasks": 0,
  "status": "paused",
  "source": "manual-pause",
  "completed_tasks": [],
  "remaining_tasks": [],
  "blockers": [],
  "human_actions_pending": [
    {
      "action": "Install crontab entry for hourly GSD release check",
      "context": "Sandbox blocked crontab -. Run: (crontab -l 2>/dev/null; echo \"17 * * * * /Users/jnuyens/claude-code-gsd/bin/check-gsd-release.sh\") | crontab -",
      "blocking": false
    }
  ],
  "decisions": [
    {"decision": "Updated opus alias to claude-opus-4-7", "rationale": "Opus 4.6 is now legacy, 4.7 is latest GA", "phase": "quick"},
    {"decision": "Use SSH to m1.linuxbe.com for email notifications", "rationale": "Avoid local mail delivery issues", "phase": "quick"},
    {"decision": "Real system crontab instead of CronCreate", "rationale": "CronCreate jobs are session-only and auto-expire after 7 days", "phase": "quick"},
    {"decision": "Synced upstream GSD v1.36.0", "rationale": "New release with 10 agents, 14 skills, graphify, TDD mode, 30+ fixes", "phase": "quick"}
  ],
  "uncommitted_files": [".planning/ROADMAP.md"],
  "next_action": "Begin Phase 05 work or review the GSD-2 feature analysis for future milestone ideas",
  "context_notes": "Session focused on quick tasks: Opus 4.7 model update, GSD-2 feature analysis, upstream notification fix, system crontab for release checks, and full 1.36.0 upgrade. All quick tasks committed. Phase 05 (next milestone phase) not yet started."
}
